{
  "$schema": "https://json-schema.org/draft/2020-12/schema",
  "$id": "https://kevinkawchak.github.io/physical-ai-oncology-trials/v3.9.1/metrics.schema.json",
  "title": "GBM 1min Metrics Record",
  "type": "object",
  "required": [
    "entity_id", "entity_kind", "iteration_id", "release_version",
    "quality_score", "total_seconds", "cost_usd", "safety_score",
    "patient_experience_score", "composite_score",
    "human_intervention_seconds",
    "force_violation_count_per_arm", "cumulative_force_violation_count",
    "estop_count", "ae_count", "heartbeat_miss_count",
    "resection_completeness_pct",
    "eloquent_preservation_score", "predicted_kps_day_30",
    "skill_mu", "skill_sigma",
    "per_arm_tissue_removed_mm3", "per_arm_force_peak_N", "per_arm_active_seconds"
  ],
  "properties": {
    "entity_id": {"type": "string"},
    "entity_kind": {"type": "string", "enum": ["this_project_1min", "this_project_1hr", "prior_version_1min", "competitor_robot", "hybrid_team", "manual_human"]},
    "iteration_id": {"type": "string", "pattern": "^run_[0-9]{5}$"},
    "release_version": {"type": "string", "pattern": "^v[0-9]+\\.[0-9]+\\.[0-9]+$"},
    "quality_score": {"type": "number", "minimum": 0, "maximum": 100},
    "total_seconds": {"type": "number", "minimum": 0, "maximum": 14400},
    "cost_usd": {"type": "number", "minimum": 0},
    "safety_score": {"type": "number", "minimum": 0, "maximum": 100},
    "patient_experience_score": {"type": "number", "minimum": 0, "maximum": 100},
    "composite_score": {"type": "number", "minimum": 0, "maximum": 100},
    "human_intervention_seconds": {"type": "integer", "minimum": 0},
    "force_violation_count_per_arm": {"type": "array", "items": {"type": "integer", "minimum": 0}, "minItems": 4, "maxItems": 4},
    "cumulative_force_violation_count": {"type": "integer", "minimum": 0},
    "estop_count": {"type": "integer", "minimum": 0},
    "ae_count": {"type": "integer", "minimum": 0},
    "heartbeat_miss_count": {"type": "integer", "minimum": 0},
    "resection_completeness_pct": {"type": "number", "minimum": 0, "maximum": 100},
    "eloquent_preservation_score": {"type": "number", "minimum": 0, "maximum": 100},
    "predicted_kps_day_30": {"type": "number", "minimum": 0, "maximum": 100},
    "skill_mu": {"type": "number"},
    "skill_sigma": {"type": "number", "minimum": 0},
    "per_arm_tissue_removed_mm3": {"type": "array", "items": {"type": "number", "minimum": 0}, "minItems": 4, "maxItems": 4},
    "per_arm_force_peak_N": {"type": "array", "items": {"type": "number", "minimum": 0}, "minItems": 4, "maxItems": 4},
    "per_arm_active_seconds": {"type": "array", "items": {"type": "number", "minimum": 0, "maximum": 60}, "minItems": 4, "maxItems": 4}
  },
  "additionalProperties": false
}
