[
  {
    "entity_id": "this_project_v3_9_1_1min",
    "entity_kind": "this_project_1min",
    "iteration_id": "run_00001",
    "release_version": "v3.9.1",
    "quality_score": 91.96,
    "total_seconds": 60.0,
    "cost_usd": 8396.6,
    "safety_score": 50.0,
    "patient_experience_score": 88.17,
    "composite_score": 87.73,
    "human_intervention_seconds": 0,
    "force_violation_count_per_arm": [
      1,
      2,
      1,
      1
    ],
    "cumulative_force_violation_count": 0,
    "estop_count": 1,
    "ae_count": 2,
    "heartbeat_miss_count": 2,
    "resection_completeness_pct": 95.64,
    "eloquent_preservation_score": 86.96,
    "predicted_kps_day_30": 81.57,
    "skill_mu": 672.85,
    "skill_sigma": 94.75,
    "per_arm_tissue_removed_mm3": [
      31977.91,
      1884.8,
      1938.01,
      92.16
    ],
    "per_arm_force_peak_N": [
      4.821,
      3.955,
      4.682,
      4.588
    ],
    "per_arm_active_seconds": [
      55.0,
      50.0,
      45.0,
      60.0
    ]
  },
  {
    "entity_id": "this_project_v3_9_1_1min",
    "entity_kind": "this_project_1min",
    "iteration_id": "run_00002",
    "release_version": "v3.9.1",
    "quality_score": 91.2,
    "total_seconds": 60.0,
    "cost_usd": 8171.25,
    "safety_score": 60.0,
    "patient_experience_score": 87.04,
    "composite_score": 88.46,
    "human_intervention_seconds": 0,
    "force_violation_count_per_arm": [
      1,
      0,
      1,
      1
    ],
    "cumulative_force_violation_count": 2,
    "estop_count": 0,
    "ae_count": 2,
    "heartbeat_miss_count": 1,
    "resection_completeness_pct": 94.85,
    "eloquent_preservation_score": 86.2,
    "predicted_kps_day_30": 80.96,
    "skill_mu": 671.36,
    "skill_sigma": 96.5,
    "per_arm_tissue_removed_mm3": [
      32688.6,
      1846.72,
      1899.08,
      113.37
    ],
    "per_arm_force_peak_N": [
      4.985,
      4.561,
      4.367,
      4.589
    ],
    "per_arm_active_seconds": [
      55.0,
      50.0,
      45.0,
      60.0
    ]
  },
  {
    "entity_id": "HUM-001",
    "entity_kind": "manual_human",
    "iteration_id": "run_00000",
    "release_version": "v3.9.1",
    "quality_score": 89.0,
    "total_seconds": 12600.0,
    "cost_usd": 18500.0,
    "safety_score": 72.0,
    "patient_experience_score": 80.0,
    "composite_score": 71.4,
    "human_intervention_seconds": 12600,
    "force_violation_count_per_arm": [
      0,
      0,
      0,
      0
    ],
    "cumulative_force_violation_count": 0,
    "estop_count": 0,
    "ae_count": 0,
    "heartbeat_miss_count": 0,
    "resection_completeness_pct": 92.0,
    "eloquent_preservation_score": 90.0,
    "predicted_kps_day_30": 80.0,
    "skill_mu": 600.0,
    "skill_sigma": 200.0,
    "per_arm_tissue_removed_mm3": [
      0.0,
      0.0,
      0.0,
      0.0
    ],
    "per_arm_force_peak_N": [
      0.0,
      0.0,
      0.0,
      0.0
    ],
    "per_arm_active_seconds": [
      0.0,
      0.0,
      0.0,
      0.0
    ]
  },
  {
    "entity_id": "HUM-002",
    "entity_kind": "manual_human",
    "iteration_id": "run_00000",
    "release_version": "v3.9.1",
    "quality_score": 85.0,
    "total_seconds": 11400.0,
    "cost_usd": 17800.0,
    "safety_score": 70.0,
    "patient_experience_score": 75.0,
    "composite_score": 68.6,
    "human_intervention_seconds": 11400,
    "force_violation_count_per_arm": [
      0,
      0,
      0,
      0
    ],
    "cumulative_force_violation_count": 0,
    "estop_count": 0,
    "ae_count": 0,
    "heartbeat_miss_count": 0,
    "resection_completeness_pct": 88.0,
    "eloquent_preservation_score": 85.0,
    "predicted_kps_day_30": 75.0,
    "skill_mu": 600.0,
    "skill_sigma": 200.0,
    "per_arm_tissue_removed_mm3": [
      0.0,
      0.0,
      0.0,
      0.0
    ],
    "per_arm_force_peak_N": [
      0.0,
      0.0,
      0.0,
      0.0
    ],
    "per_arm_active_seconds": [
      0.0,
      0.0,
      0.0,
      0.0
    ]
  }
]